{
  "slug": "np-rasuwa-landslide-2026",
  "title": "Nepal Rasuwa Catastrophic Landslide 2026",
  "title_zh": "尼泊尔热索瓦（Rasuwa）特大泥石流灾害",
  "event_type": "Debris flow / flash flood",
  "event_type_zh": "泥石流 / 山洪",
  "country": "Nepal",
  "region": "Rasuwa, Nuwakot, Dhading, Gorkha and Chitwan districts along the Trishuli River; impacts reach the China–Nepal Gyirong–Rasuwagadhi border crossing",
  "region_zh": "热索瓦、努瓦果德、塔丁、廓尔喀、奇特旺（特里苏里河沿岸），波及中尼吉隆—拉苏瓦堡口岸一侧",
  "onset": "2026-08-26T09:00+05:45",
  "status": "active",
  "severity": "extreme",
  "last_updated": "2026-08-28T17:00+08:00",
  "summary": "On the morning of 26 August 2026, a catastrophic debris flow struck Rasuwa district in northern Nepal, triggering cascading river-bank disasters along the Trishuli River with heavy casualties and infrastructure loss. The Nepali side of the Gyirong–Rasuwagadhi border crossing with China was severely hit, and many foreign trekkers and Nepali citizens remain missing. The Government of Nepal has activated its highest-level emergency response; the Army, Police and Armed Police Force are fully engaged in search and rescue, with coordinated China–Nepal verification and relief efforts under way.",
  "summary_zh": "2026年8月26日上午，尼泊尔北部热索瓦地区发生大规模泥石流并引发沿河次生灾害，特里苏里河沿岸多地出现重大人员伤亡和财产损失。中国吉隆—尼泊尔拉苏瓦堡口岸尼方一侧受灾严重，大量外籍游客与尼泊尔公民失联。尼泊尔政府已启动最高级应急响应，军队、警察、武装警察部队全面投入搜救，中尼两侧正协同开展搜救与核实工作。",
  "kpis": [
    { "label": "Confirmed deaths", "label_zh": "遇难人数", "value": 289, "unit": "persons", "note": "as of Aug 27 evening, per Nepal Police", "note_zh": "截至 8/27 晚，尼泊尔警方口径" },
    { "label": "Missing", "label_zh": "失联人数", "value": 910, "unit": "persons", "note": "includes hundreds of foreign trekkers; ~100 Chinese citizens missing on the Nepali side", "note_zh": "含数百名外籍游客；尼方一侧失联中国公民近百人" },
    { "label": "Vehicle bridges damaged", "label_zh": "受损可通车桥梁", "value": 35, "unit": "bridges", "note": "a further 45 suspension footbridges damaged", "note_zh": "另有 45 座吊桥受损" },
    { "label": "Paved roads damaged", "label_zh": "受损铺装道路", "value": 40, "unit": "km", "note": "the ~42 km Nuwakot–Rasuwagadhi corridor severed in multiple places", "note_zh": "努瓦果德—拉苏瓦堡约 42 公里通道多处中断" },
    { "label": "Affected districts", "label_zh": "受灾县", "value": 5, "unit": "districts", "note": "Rasuwa, Nuwakot, Dhading, Gorkha, Chitwan", "note_zh": "热索瓦、努瓦果德、塔丁、廓尔喀、奇特旺" },
    { "label": "Missing foreign nationals (per Chinese side)", "label_zh": "失联外籍人员（中方口径）", "value": 260, "unit": "persons", "note": "per Gyirong (Tibet) authorities; under verification", "note_zh": "据西藏吉隆发布，正在核查中" }
  ],
  "casualty_series": [
    { "label": "Aug 26 eve", "label_zh": "8/26 晚", "dead": 17, "missing": 384 },
    { "label": "Aug 27 noon", "label_zh": "8/27 午间", "dead": 270, "missing": null },
    { "label": "Aug 27 eve", "label_zh": "8/27 晚", "dead": 289, "missing": 910 }
  ],
  "sites": [
    {
      "name": "Rasuwagadhi border crossing",
      "name_zh": "拉苏瓦堡口岸（Rasuwagadhi）",
      "lat": 28.316,
      "lon": 85.108,
      "category": "incident",
      "description": "Core debris-flow impact zone. The Nepali side of the China–Nepal land corridor was severely hit; crossing operations suspended. (approximate location)",
      "description_zh": "泥石流核心发生区。中尼陆路通道尼方一侧受灾严重，口岸运行中断。（坐标为近似定位）",
      "as_of": "2026-08-26"
    },
    {
      "name": "Timure",
      "name_zh": "提穆尔（Timure）",
      "lat": 28.225,
      "lon": 85.205,
      "category": "community",
      "description": "Riverside settlement hit by the flow; road and telecom links cut. (approximate location)",
      "description_zh": "沿河受灾村镇，道路与通信中断。（坐标为近似定位）",
      "as_of": "2026-08-27"
    },
    {
      "name": "Syabrubesi",
      "name_zh": "夏布鲁贝西（Syabrubesi）",
      "lat": 28.166,
      "lon": 85.333,
      "category": "community",
      "description": "Gateway village to the Langtang trekking area; heavily affected, a concentration point for trekkers. (approximate location)",
      "description_zh": "通往朗塘地区的门户村镇，受灾严重，为徒步游客集中区域。（坐标为近似定位）",
      "as_of": "2026-08-27"
    },
    {
      "name": "Dhunche",
      "name_zh": "敦切（Dhunche）",
      "lat": 28.107,
      "lon": 85.292,
      "category": "command",
      "description": "District headquarters of Rasuwa; forward rescue command and logistics staging point. (approximate location)",
      "description_zh": "热索瓦县治，前方救援指挥与物资集结点。（坐标为近似定位）",
      "as_of": "2026-08-27"
    },
    {
      "name": "Nuwakot–Rasuwagadhi road severed sections",
      "name_zh": "努瓦果德—拉苏瓦堡道路中断段",
      "lat": 28.0,
      "lon": 85.18,
      "category": "damage",
      "description": "~42 km of road destroyed in multiple places, several concrete bridges washed out; a key China–Nepal land link severed. (approximate location)",
      "description_zh": "约 42 公里道路多处被毁、多座混凝土桥被冲毁，连接中尼的重要陆路通道中断。（坐标为近似定位）",
      "as_of": "2026-08-26"
    },
    {
      "name": "Betrawati",
      "name_zh": "贝特拉瓦蒂（Betrawati）",
      "lat": 27.977,
      "lon": 85.192,
      "category": "damage",
      "description": "One of the riverside bridge and road damage points. (approximate location)",
      "description_zh": "沿河桥梁与道路受损点之一。（坐标为近似定位）",
      "as_of": "2026-08-27"
    },
    {
      "name": "Devighat river reach",
      "name_zh": "德维加特（Devighat）河段",
      "lat": 27.915,
      "lon": 85.15,
      "category": "risk",
      "description": "Monitored risk reach along the Trishuli River; downstream watch ongoing. (approximate location)",
      "description_zh": "特里苏里河沿岸风险河段，下游持续监测中。（坐标为近似定位）",
      "as_of": "2026-08-27"
    },
    {
      "name": "Mugling corridor",
      "name_zh": "穆格林（Mugling）廊道",
      "lat": 27.75,
      "lon": 84.6,
      "category": "risk",
      "description": "Riverside risk zone in Chitwan; dense bridge cluster under priority inspection. (approximate location)",
      "description_zh": "奇特旺境内沿河风险区，桥梁密集段重点排查。（坐标为近似定位）",
      "as_of": "2026-08-27"
    },
    {
      "name": "Kathmandu SAR base",
      "name_zh": "加德满都搜救基地",
      "lat": 27.717,
      "lon": 85.324,
      "category": "resource",
      "description": "Helicopter search-and-rescue and medical evacuation base. (approximate location)",
      "description_zh": "直升机搜救与医疗后送基地。（坐标为近似定位）",
      "as_of": "2026-08-27"
    },
    {
      "name": "Gyirong border crossing (Chinese side, coordination)",
      "name_zh": "吉隆口岸（中方，协同方向）",
      "lat": 28.325,
      "lon": 85.322,
      "category": "resource",
      "description": "Chinese-side information verification and China–Nepal SAR coordination. (approximate location)",
      "description_zh": "中方一侧信息核查与中尼搜救协调方向。（坐标为近似定位）",
      "as_of": "2026-08-27"
    }
  ],
  "corridor": {
    "name": "Trishuli River risk corridor",
    "name_zh": "特里苏里河沿河风险廊道",
    "note": "Debris flow and flash flood propagated downstream; the river banks concentrate casualties and infrastructure damage (schematic trace, not the exact channel)",
    "note_zh": "泥石流及山洪沿河下泄，沿岸为人员伤亡与设施损毁集中带（示意走向，非精确河道）",
    "coords": [
      [28.33, 85.11],
      [28.25, 85.16],
      [28.16, 85.28],
      [28.0, 85.18],
      [27.915, 85.15],
      [27.85, 84.95],
      [27.78, 84.75],
      [27.7, 84.55],
      [27.69, 84.43]
    ]
  },
  "resources": [
    {
      "name": "Nepal Army (NA)",
      "name_zh": "尼泊尔军队（NA）",
      "type": "military",
      "type_zh": "军队",
      "strength": "multiple active-duty contingents committed",
      "strength_zh": "现役部队多批次投入",
      "tasks": "helicopter air SAR, road reopening, recovery of victims",
      "tasks_zh": "直升机空中搜救、道路抢通、遇难者搜寻",
      "base": "Kathmandu / Dhunche forward",
      "base_zh": "加德满都 / 敦切前方"
    },
    {
      "name": "Nepal Armed Police Force (APF)",
      "name_zh": "尼泊尔武装警察部队（APF）",
      "type": "paramilitary",
      "type_zh": "准军事",
      "tasks": "on-site search and rescue, access control in the disaster zone",
      "tasks_zh": "现场搜救、灾区人员管控",
      "base": "Rasuwa disaster zone",
      "base_zh": "热索瓦灾区"
    },
    {
      "name": "Nepal Police",
      "name_zh": "尼泊尔警察（Nepal Police）",
      "type": "police",
      "type_zh": "警察",
      "tasks": "casualty accounting, missing-persons verification, site order",
      "tasks_zh": "伤亡统计、失联人员核查、现场秩序",
      "base": "affected districts along the river",
      "base_zh": "沿线各县"
    },
    {
      "name": "Local SAR teams and medical forces",
      "name_zh": "地方政府搜救队与医疗力量",
      "type": "local",
      "type_zh": "地方",
      "tasks": "on-site first aid and casualty evacuation",
      "tasks_zh": "现场急救与伤员后送",
      "base": "Dhunche / Betrawati",
      "base_zh": "敦切 / 贝特拉瓦蒂"
    },
    {
      "name": "Chinese Embassy in Nepal",
      "name_zh": "中国驻尼泊尔大使馆",
      "type": "international coordination",
      "type_zh": "跨国协调",
      "tasks": "verifying missing Chinese citizens, coordinating joint China–Nepal SAR",
      "tasks_zh": "核实失联中国公民、协调中尼联合搜救",
      "base": "Kathmandu",
      "base_zh": "加德满都"
    },
    {
      "name": "Chinese side (Gyirong direction)",
      "name_zh": "中方（吉隆方向）",
      "type": "international coordination",
      "type_zh": "跨国协调",
      "tasks": "verification of missing foreign nationals, coordination at the border crossing",
      "tasks_zh": "失联外籍人员信息核查、口岸一侧协同",
      "base": "Gyirong border crossing",
      "base_zh": "吉隆口岸"
    }
  ],
  "updates": [
    {
      "time": "2026-08-28",
      "text": "Search and rescue continues; Nepal's weather department forecasts further rain in the north in coming days, challenging road access and relief. Casualty figures may still rise.",
      "text_zh": "搜救持续推进；尼气象部门预计未来数日北部仍有降雨，道路通行与救援面临挑战，伤亡数字可能进一步上升。",
      "tag": "forecast",
      "tag_zh": "预报"
    },
    {
      "time": "2026-08-27 evening",
      "text": "Nepal Police: at least 289 dead and 910 missing (including hundreds of foreign trekkers). The disaster has damaged 35 vehicle bridges, 45 suspension bridges and 40 km of paved road.",
      "text_zh": "尼泊尔警方通报：遇难人数升至至少 289 人、910 人失联（含数百名外籍游客）。灾害已致 35 座可通车桥梁、45 座吊桥和 40 公里铺装道路受损。",
      "tag": "impact",
      "tag_zh": "灾情"
    },
    {
      "time": "2026-08-27",